{
  "schemaVersion": 1,
  "batchId": "phase1-batch1-approved-rarity-frames",
  "phase": "phase1",
  "createdAt": "2026-08-07T05:39:09+08:00",
  "sourceCommit": "f84c588b8b721135a505719b5dd48e082a932dc1",
  "status": "planned",
  "entries": [
    {
      "resourceKind": "file",
      "assetId": "frame-n-v1.0-emerald-antique-gold",
      "driveResourceId": "1KO7NHfipw-MlFfYLDaakHuupGjtrwYu8",
      "operation": "move",
      "before": {
        "name": "CICG_CardFrame_Rarity_N_v1.0_Approved.png",
        "parentFolderId": "1cH0KYWGvUT5ci57HW8JBFv3v-8uG51IC",
        "mimeType": "image/png",
        "sizeBytes": 2285281,
        "sha256": "17e6a6798e491ad2bad12b5746e7c3414078e456b83838db2e75aa0a7352ae65",
        "webViewLink": "https://drive.google.com/file/d/1KO7NHfipw-MlFfYLDaakHuupGjtrwYu8/view"
      },
      "after": {
        "name": "CICG_CardFrame_Rarity_N_v1.0_Approved.png",
        "parentFolderId": "1RtNhgm93m0EXq3fNJlvuVuIwbWQhL4mj",
        "mimeType": "image/png",
        "sizeBytes": 2285281,
        "sha256": "17e6a6798e491ad2bad12b5746e7c3414078e456b83838db2e75aa0a7352ae65",
        "webViewLink": "https://drive.google.com/file/d/1KO7NHfipw-MlFfYLDaakHuupGjtrwYu8/view"
      },
      "rollback": {
        "name": "CICG_CardFrame_Rarity_N_v1.0_Approved.png",
        "parentFolderId": "1cH0KYWGvUT5ci57HW8JBFv3v-8uG51IC",
        "mimeType": "image/png",
        "sizeBytes": 2285281,
        "sha256": "17e6a6798e491ad2bad12b5746e7c3414078e456b83838db2e75aa0a7352ae65",
        "webViewLink": "https://drive.google.com/file/d/1KO7NHfipw-MlFfYLDaakHuupGjtrwYu8/view"
      },
      "status": "planned",
      "blockingReason": null
    },
    {
      "resourceKind": "file",
      "assetId": "frame-r-v1.0-frost-blue-steel",
      "driveResourceId": "18AgLp9b1hCrqawfsk5-OxPlmgSt93YGR",
      "operation": "move",
      "before": {
        "name": "CICG_CardFrame_Rarity_R_v1.0_Approved.png",
        "parentFolderId": "1cH0KYWGvUT5ci57HW8JBFv3v-8uG51IC",
        "mimeType": "image/png",
        "sizeBytes": 2191391,
        "sha256": "3620f4408b31055d0e6ea185fa08dd5be13a33687321191035ac0ba30b9fdf2d",
        "webViewLink": "https://drive.google.com/file/d/18AgLp9b1hCrqawfsk5-OxPlmgSt93YGR/view"
      },
      "after": {
        "name": "CICG_CardFrame_Rarity_R_v1.0_Approved.png",
        "parentFolderId": "1RtNhgm93m0EXq3fNJlvuVuIwbWQhL4mj",
        "mimeType": "image/png",
        "sizeBytes": 2191391,
        "sha256": "3620f4408b31055d0e6ea185fa08dd5be13a33687321191035ac0ba30b9fdf2d",
        "webViewLink": "https://drive.google.com/file/d/18AgLp9b1hCrqawfsk5-OxPlmgSt93YGR/view"
      },
      "rollback": {
        "name": "CICG_CardFrame_Rarity_R_v1.0_Approved.png",
        "parentFolderId": "1cH0KYWGvUT5ci57HW8JBFv3v-8uG51IC",
        "mimeType": "image/png",
        "sizeBytes": 2191391,
        "sha256": "3620f4408b31055d0e6ea185fa08dd5be13a33687321191035ac0ba30b9fdf2d",
        "webViewLink": "https://drive.google.com/file/d/18AgLp9b1hCrqawfsk5-OxPlmgSt93YGR/view"
      },
      "status": "planned",
      "blockingReason": null
    },
    {
      "resourceKind": "file",
      "assetId": "frame-sr-v1.0-royal-violet",
      "driveResourceId": "1cZPhfFv483bJAxk0kCBj6XS4V6Vyfx40",
      "operation": "move",
      "before": {
        "name": "CICG_CardFrame_Rarity_SR_v1.0_Approved.png",
        "parentFolderId": "1cH0KYWGvUT5ci57HW8JBFv3v-8uG51IC",
        "mimeType": "image/png",
        "sizeBytes": 2454266,
        "sha256": "4976cd5ead7042edc24808183ea2415de1491ddd1d9d95b18d889fb0e95de073",
        "webViewLink": "https://drive.google.com/file/d/1cZPhfFv483bJAxk0kCBj6XS4V6Vyfx40/view"
      },
      "after": {
        "name": "CICG_CardFrame_Rarity_SR_v1.0_Approved.png",
        "parentFolderId": "1RtNhgm93m0EXq3fNJlvuVuIwbWQhL4mj",
        "mimeType": "image/png",
        "sizeBytes": 2454266,
        "sha256": "4976cd5ead7042edc24808183ea2415de1491ddd1d9d95b18d889fb0e95de073",
        "webViewLink": "https://drive.google.com/file/d/1cZPhfFv483bJAxk0kCBj6XS4V6Vyfx40/view"
      },
      "rollback": {
        "name": "CICG_CardFrame_Rarity_SR_v1.0_Approved.png",
        "parentFolderId": "1cH0KYWGvUT5ci57HW8JBFv3v-8uG51IC",
        "mimeType": "image/png",
        "sizeBytes": 2454266,
        "sha256": "4976cd5ead7042edc24808183ea2415de1491ddd1d9d95b18d889fb0e95de073",
        "webViewLink": "https://drive.google.com/file/d/1cZPhfFv483bJAxk0kCBj6XS4V6Vyfx40/view"
      },
      "status": "planned",
      "blockingReason": null
    },
    {
      "resourceKind": "file",
      "assetId": "frame-ssr-v2.8-rainbow-neon",
      "driveResourceId": "1_PR-_mZXBkf7WJxXwq83AjaOvWpUJwbz",
      "operation": "move",
      "before": {
        "name": "CICG_CardTemplate_Rarity_SSR_v2.8_Approved.png",
        "parentFolderId": "1cH0KYWGvUT5ci57HW8JBFv3v-8uG51IC",
        "mimeType": "image/png",
        "sizeBytes": 3480599,
        "sha256": "8bf608d7ba64b1efe787b8f6e0939c55a7d7623d5d9a791e5a260a144a9b328e",
        "webViewLink": "https://drive.google.com/file/d/1_PR-_mZXBkf7WJxXwq83AjaOvWpUJwbz/view"
      },
      "after": {
        "name": "CICG_CardTemplate_Rarity_SSR_v2.8_Approved.png",
        "parentFolderId": "1RtNhgm93m0EXq3fNJlvuVuIwbWQhL4mj",
        "mimeType": "image/png",
        "sizeBytes": 3480599,
        "sha256": "8bf608d7ba64b1efe787b8f6e0939c55a7d7623d5d9a791e5a260a144a9b328e",
        "webViewLink": "https://drive.google.com/file/d/1_PR-_mZXBkf7WJxXwq83AjaOvWpUJwbz/view"
      },
      "rollback": {
        "name": "CICG_CardTemplate_Rarity_SSR_v2.8_Approved.png",
        "parentFolderId": "1cH0KYWGvUT5ci57HW8JBFv3v-8uG51IC",
        "mimeType": "image/png",
        "sizeBytes": 3480599,
        "sha256": "8bf608d7ba64b1efe787b8f6e0939c55a7d7623d5d9a791e5a260a144a9b328e",
        "webViewLink": "https://drive.google.com/file/d/1_PR-_mZXBkf7WJxXwq83AjaOvWpUJwbz/view"
      },
      "status": "planned",
      "blockingReason": null
    }
  ]
}
